,id,forum,number,title,abstract,authors,authorids,venue,venueid,primary_area,pdf,cdate_iso,pdate_iso,mdate_iso,openreview_url,institutions
2942,mp8u2Pcmqz,mp8u2Pcmqz,5272,DuQuant: Distributing Outliers via Dual Transformation Makes Stronger Quantized LLMs,"Quantization of large language models (LLMs) faces significant challenges, particularly due to the presence of outlier activations that impede efficient low-bit representation. Traditional approaches predominantly address Normal Outliers, which are activations across all tokens with relatively large magnitudes. However, these methods struggle with smoothing Massive Outliers that display significantly larger values, which leads to significant performance degradation in low-bit quantization. In this paper, we introduce DuQuant, a novel approach that utilizes rotation and permutation transformations to more effectively mitigate both massive and normal outliers. First, DuQuant starts by constructing the rotation matrix, using specific outlier dimensions as prior knowledge, to redistribute outliers to adjacent channels by block-wise rotation. Second, We further employ a zigzag permutation to balance the distribution of outliers across blocks, thereby reducing block-wise variance. A subsequent rotation further smooths the activation landscape, enhancing model performance. DuQuant simplifies the quantization process and excels in managing outliers, outperforming the state-of-the-art baselines across various sizes and types of LLMs on multiple tasks, even with 4-bit weight-activation quantization. Our code is available at https://github.com/Hsu1023/DuQuant.",Haokun Lin; Haobo Xu; Yichen Wu; Jingzhi Cui; Yingtao Zhang; Linzhan Mou; Linqi Song; Zhenan Sun; Ying Wei,~Haokun_Lin4; ~Haobo_Xu2; ~Yichen_Wu2; ~Jingzhi_Cui1; ~Yingtao_Zhang3; ~Linzhan_Mou1; ~Linqi_Song1; ~Zhenan_Sun1; ~Ying_Wei1,NeurIPS 2024 oral,NeurIPS.cc/2024/Conference,natural_language_processing,/pdf/f75c5ce9e83cea209b9b5807072a3537bac72822.pdf,2024-05-12T13:17:43.927000,2024-09-25T18:09:38.573000,2025-01-14T16:23:28.817000,https://openreview.net/forum?id=mp8u2Pcmqz,"University of Chinese Academy of Sciences; City University of Hong Kong; Tsinghua University, Beijing; Harvard University; City University of Hong Kong; Tsinghua University, Beijing; Tsinghua University, Beijing; Zhejiang University; City University of Hong Kong; University of Chinese Academy of Sciences; Zhejiang University; Nanyang Technological University"
2954,8aA3DHLK5h,8aA3DHLK5h,5213,Extensive-Form Game Solving via Blackwell Approachability on Treeplexes,"We introduce the first algorithmic framework for Blackwell approachability on the sequence-form polytope, the class of convex polytopes capturing the strategies of players in extensive-form games (EFGs).
This leads to a new class of regret-minimization algorithms that are stepsize-invariant, in the same sense as the Regret Matching and Regret Matching$^+$ algorithms for the simplex.
Our modular framework can be combined with any existing regret minimizer over cones to compute a Nash equilibrium in two-player zero-sum EFGs with perfect recall, through the self-play framework. Leveraging predictive online mirror descent, we introduce *Predictive Treeplex Blackwell$^+$* (PTB$^+$), and show a $O(1/\sqrt{T})$ convergence rate to Nash equilibrium in self-play. We then show how to stabilize PTB$^+$ with a stepsize, resulting in an algorithm with a state-of-the-art $O(1/T)$ convergence rate. 
We provide an extensive set of experiments to compare our framework with several algorithmic benchmarks, including CFR$^+$ and its predictive variant, and we highlight interesting connections between practical performance and the stepsize-dependence or stepsize-invariance properties of classical algorithms.",Darshan Chakrabarti; Julien Grand-Clément; Christian Kroer,~Darshan_Chakrabarti1; ~Julien_Grand-Clément1; ~Christian_Kroer1,NeurIPS 2024 spotlight,NeurIPS.cc/2024/Conference,algorithmic_game_theory,/pdf/df42beac9e6141101c00c68dafab3a0648264998.pdf,2024-05-12T11:58:49.330000,2024-09-25T18:09:37.112000,2024-11-06T06:18:02.914000,https://openreview.net/forum?id=8aA3DHLK5h,Columbia University; Columbia University
2956,0NMzBwqaAJ,0NMzBwqaAJ,5208,Not All Tokens Are What You Need for Pretraining,"Previous language model pre-training methods have uniformly applied a next-token prediction loss to all training tokens. Challenging this norm, we posit that ''Not all tokens in a corpus are equally important for language model training''. Our initial analysis examines token-level training dynamics of language model, revealing distinct loss patterns for different tokens. Leveraging these insights, we introduce a new language model called Rho-1. Unlike traditional LMs that learn to predict every next token in a corpus, Rho-1 employs Selective Language Modeling (SLM), which selectively trains on useful tokens that aligned with the desired distribution. This approach involves scoring training tokens using a reference model, and then training the language model with a focused loss on tokens with higher scores. When continual continual pretraining on 15B OpenWebMath corpus, Rho-1 yields an absolute improvement in few-shot accuracy of up to 30% in 9 math tasks. After fine-tuning, Rho-1-1B and 7B achieved state-of-the-art results of 40.6% and 51.8% on MATH dataset, respectively - matching DeepSeekMath with only 3% of the pretraining tokens. Furthermore, when continual pretraining on 80B general tokens, Rho-1 achieves 6.8% average enhancement across 15 diverse tasks, increasing both data efficiency and performance of the language model pre-training.",Zhenghao Lin; Zhibin Gou; Yeyun Gong; Xiao Liu; yelong shen; Ruochen Xu; Chen Lin; Yujiu Yang; Jian Jiao; Nan Duan; Weizhu Chen,~Zhenghao_Lin1; ~Zhibin_Gou1; ~Yeyun_Gong2; ~Xiao_Liu14; ~yelong_shen1; ~Ruochen_Xu2; ~Chen_Lin5; ~Yujiu_Yang2; ~Jian_Jiao2; ~Nan_Duan1; ~Weizhu_Chen1,NeurIPS 2024 oral,NeurIPS.cc/2024/Conference,natural_language_processing,/pdf/322b6309b2e8e9565af8f7bd497dae2d47861bc5.pdf,2024-05-12T11:51:38.411000,2024-09-25T18:09:36.903000,2025-01-08T09:30:53.148000,https://openreview.net/forum?id=0NMzBwqaAJ,"Xiamen University; Microsoft; Microsoft; Microsoft; Microsoft; 01.AI; Microsoft; Xiamen University; Tsinghua University, Beijing; Microsoft; Stepfun; Microsoft; Microsoft"
2960,rhCgizNupi,rhCgizNupi,5179,Reranking Laws for Language Generation: A Communication-Theoretic Perspective,"To ensure large language models (LLMs) are used safely, one must reduce their propensity to hallucinate or to generate unacceptable answers. A simple and often used strategy is to first let the LLM generate multiple hypotheses and then employ a reranker to choose the best one. In this paper, we draw a parallel between this strategy and the use of redundancy to decrease the error rate in noisy communication channels. We conceptualize the generator as a sender transmitting multiple descriptions of a message through parallel noisy channels. The receiver decodes the message by ranking the (potentially corrupted) descriptions and selecting the one found to be most reliable. We provide conditions under which this protocol is asymptotically error-free (i.e., yields an acceptable answer almost surely) even in scenarios where the reranker is imperfect (governed by Mallows or Zipf-Mandelbrot models) and the channel distributions are statistically dependent. We use our framework to obtain reranking laws which we validate empirically on two real-world tasks using LLMs: text-to-code generation with DeepSeek-Coder 7B and machine translation of medical data with TowerInstruct 13B.",António Farinhas; Haau-Sing Li; Andre Martins,~António_Farinhas1; ~Haau-Sing_Li1; ~Andre_Martins1,NeurIPS 2024 spotlight,NeurIPS.cc/2024/Conference,natural_language_processing,/pdf/1d824c959b9a0a08e7614ea8420a49d8b2d56b9c.pdf,2024-05-12T10:41:29.696000,2024-09-25T18:09:36.061000,2024-11-06T06:18:02.678000,https://openreview.net/forum?id=rhCgizNupi,"Instituto de Telecomunicações, Portugal; ELLIS Institute, Tübingen; Technical University of Darmstadt; Unbabel; Instituto Superior Técnico"
2967,6ZBHIEtdP4,6ZBHIEtdP4,5120,PiSSA: Principal Singular Values and Singular Vectors Adaptation of Large Language Models,"To parameter-efficiently fine-tune (PEFT) large language models (LLMs), the low-rank adaptation (LoRA) method approximates the model changes $\Delta W \in \mathbb{R}^{m \times n}$ through the product of two matrices $A \in \mathbb{R}^{m \times r}$ and $B \in \mathbb{R}^{r \times n}$, where $r \ll \min(m, n)$, $A$ is initialized with Gaussian noise, and $B$ with zeros. LoRA **freezes the original model $W$** and **updates the ""Noise \& Zero"" adapter**, which may lead to slow convergence. To overcome this limitation, we introduce **P**r**i**ncipal **S**ingular values and **S**ingular vectors **A**daptation (PiSSA). PiSSA shares the same architecture as LoRA, but initializes the adaptor matrices $A$ and $B$ with the principal components of the original matrix $W$, and put the remaining components into a residual matrix $W^{res} \in \mathbb{R}^{m \times n}$ which is frozen during fine-tuning.
Compared to LoRA, PiSSA **updates the principal components** while **freezing the ""residual"" parts**, allowing faster convergence and enhanced performance. Comparative experiments of PiSSA and LoRA across 11 different models, ranging from 184M to 70B, encompassing 5 NLG and 8 NLU tasks, reveal that PiSSA consistently outperforms LoRA under identical experimental setups. On the GSM8K benchmark, Gemma-7B fine-tuned with PiSSA achieves an accuracy of 77.7\%, surpassing LoRA's 74.53\% by 3.25\%. Due to the same architecture, PiSSA is also compatible with quantization to further reduce the memory requirement of fine-tuning. Compared to QLoRA, QPiSSA (PiSSA with 4-bit quantization) exhibits smaller quantization errors in the initial stages. Fine-tuning LLaMA-3-70B on GSM8K, QPiSSA attains an accuracy of 86.05\%, exceeding the performances of QLoRA at 81.73\%. Leveraging a fast SVD technique, PiSSA can be initialized in only a few seconds, presenting a negligible cost for transitioning from LoRA to PiSSA.",Fanxu Meng; Zhaohui Wang; Muhan Zhang,~Fanxu_Meng1; ~Zhaohui_Wang2; ~Muhan_Zhang1,NeurIPS 2024 spotlight,NeurIPS.cc/2024/Conference,optimization_for_deep_networks,/pdf/a9ffb96fadbc12583951c22e68a1611536eaf521.pdf,2024-05-12T09:04:34.055000,2024-09-25T18:09:34.413000,2024-11-06T06:18:02.410000,https://openreview.net/forum?id=6ZBHIEtdP4,Peking University; Tencent; University of Chinese Academy of Sciences; Peking University
2969,NGuGVT7ar2,NGuGVT7ar2,5110,Enhancing LLM Reasoning via Vision-Augmented Prompting,"Verbal and visual-spatial information processing are two critical subsystems that activate different brain regions and often collaborate together for cognitive reasoning. Despite the rapid advancement of LLM-based reasoning, the mainstream frameworks, such as Chain-of-Thought (CoT) and its variants, primarily focus on the verbal dimension, resulting in limitations in tackling reasoning problems with visual and spatial clues. To bridge the gap, we propose a novel dual-modality reasoning framework called Vision-Augmented Prompting (VAP). Upon receiving a textual problem description, VAP automatically synthesizes an image from the visual and spatial clues by utilizing external drawing tools. Subsequently, VAP formulates a chain of thought in both modalities and iteratively refines the synthesized image. Finally, a conclusive reasoning scheme based on self-alignment is proposed for final result generation. Extensive experiments are conducted across four versatile tasks, including solving geometry problems, Sudoku, time series prediction, and travelling salesman problem. The results validated the superiority of VAP over existing LLMs-based reasoning frameworks.",Ziyang Xiao; Dongxiang Zhang; Xiongwei Han; Xiaojin Fu; Wing Yin YU; Tao Zhong; Sai Wu; Yuan Jessica Wang; Jianwei Yin; Gang Chen,~Ziyang_Xiao2; ~Dongxiang_Zhang2; ~Xiongwei_Han1; ~Xiaojin_Fu1; ~Wing_Yin_YU1; ~Tao_Zhong2; ~Sai_Wu2; ~Yuan_Jessica_Wang1; ~Jianwei_Yin1; ~Gang_Chen6,NeurIPS 2024 spotlight,NeurIPS.cc/2024/Conference,other,/pdf/e5b33b51f40c74900516f4e0bd0f6074a89de4a2.pdf,2024-05-12T08:53:47.093000,2024-09-25T18:09:33.997000,2024-12-19T03:35:37.410000,https://openreview.net/forum?id=NGuGVT7ar2,Zhejiang University; Huawei Technologies Research & Development (UK) Ltd; Huawei Technologies Research & Development (UK) Ltd; Huawei Technologies Research & Development (UK) Ltd; Zhejiang University; Zhejiang University; Zhejiang Sci-Tech University
2978,M8dy0ZuSb1,M8dy0ZuSb1,5074,Improving robustness to corruptions with multiplicative weight perturbations,"Deep neural networks (DNNs) excel on clean images but struggle with corrupted ones. Incorporating specific corruptions into the data augmentation pipeline can improve robustness to those corruptions but may harm performance on clean images and other types of distortion. In this paper, we introduce an alternative approach that improves the robustness of DNNs to a wide range of corruptions without compromising accuracy on clean images. We first demonstrate that input perturbations can be mimicked by multiplicative perturbations in the weight space. Leveraging this, we propose Data Augmentation via Multiplicative Perturbation (DAMP), a training method that optimizes DNNs under random multiplicative weight perturbations. We also examine the recently proposed Adaptive Sharpness-Aware Minimization (ASAM) and show that it optimizes DNNs under adversarial multiplicative weight perturbations. Experiments on image classification datasets (CIFAR-10/100, TinyImageNet and ImageNet) and neural network architectures (ResNet50, ViT-S/16, ViT-B/16) show that DAMP enhances model generalization performance in the presence of corruptions across different settings. Notably, DAMP is able to train a ViT-S/16 on ImageNet from scratch, reaching the top-1 error of 23.7% which is comparable to ResNet50 without extensive data augmentations.",Trung Trinh; Markus Heinonen; Luigi Acerbi; Samuel Kaski,~Trung_Trinh1; ~Markus_Heinonen1; ~Luigi_Acerbi1; ~Samuel_Kaski1,NeurIPS 2024 spotlight,NeurIPS.cc/2024/Conference,optimization_for_deep_networks,/pdf/cd357863b16fdaa3cf6a01d9517ccb415b187402.pdf,2024-05-12T08:09:52.458000,2024-09-25T18:09:32.842000,2024-12-24T10:16:36.303000,https://openreview.net/forum?id=M8dy0ZuSb1,Aalto University; Aalto University; University of Helsinki; Helsinki Institute for Information Technology; Aalto University; University of Manchester
3002,FGTDe6EA0B,FGTDe6EA0B,4978,Language Generation in the Limit,"Although current large language models are complex, the most basic specifications of the underlying language generation problem itself are simple to state: given a finite set of training samples from an unknown language, produce valid new strings from the language that don't already appear in the training data. Here we ask what we can conclude about language generation using only this specification, without further assumptions. In particular, suppose that an adversary enumerates the strings of an unknown target language L that is known only to come from one of a possibly infinite list of candidates. A computational agent is trying to learn to generate from this language; we say that the agent generates from $L$ in the limit if after some finite point in the enumeration of $L$, the agent is able to produce new elements that come exclusively from $L$ and that have not yet been presented by the adversary. Our main result is that there is an agent that is able to generate in the limit for every countable list of candidate languages. This contrasts dramatically with negative results due to Gold and Angluin in a well-studied model of language learning where the goal is to identify an unknown language from samples; the difference between these results suggests that identifying a language is a fundamentally different problem than generating from it.",Jon Kleinberg; Sendhil Mullainathan,~Jon_Kleinberg3; ~Sendhil_Mullainathan2,NeurIPS 2024 spotlight,NeurIPS.cc/2024/Conference,learning_theory,/pdf/9b6d3b0766755bf0260924f8028eb512c04846ec.pdf,2024-05-12T05:28:23.687000,2024-09-25T18:09:26.533000,2024-11-06T06:18:00.783000,https://openreview.net/forum?id=FGTDe6EA0B,University of Chicago
3004,mZwilh3hd2,mZwilh3hd2,4969,Polynomial-Time Computation of Exact $\Phi$-Equilibria in Polyhedral Games,"It is a well-known fact that correlated equilibria can be computed in polynomial time in a large class of concisely represented games using the celebrated Ellipsoid Against Hope algorithm \citep{Papadimitriou2008:Computing, Jiang2015:Polynomial}. However, the landscape of efficiently computable equilibria in sequential (extensive-form) games remains unknown. The Ellipsoid Against Hope does not apply directly to these games, because they do not have the required ``polynomial type'' property. Despite this barrier, \citet{Huang2008:Computing} altered the algorithm to compute exact extensive-form correlated equilibria.

In this paper, we generalize the Ellipsoid Against Hope and develop a simple algorithmic framework for efficiently computing saddle-points in bilinear zero-sum games, even when one of the dimensions is exponentially large. Moreover, the framework only requires a ``good-enough-response'' oracle, which is a weakened notion of a best-response oracle.

Using this machinery, we develop a general algorithmic framework for computing exact linear $\Phi$-equilibria in any polyhedral game (under mild assumptions), including correlated equilibria in normal-form games, and extensive-form correlated equilibria in extensive-form games. This enables us to give the first polynomial-time algorithm for computing exact linear-deviation correlated equilibria in extensive-form games, thus resolving an open question by \citet{Farina2023:Polynomial}. Furthermore, even for the cases for which a polynomial time algorithm for exact equilibria was already known, our framework provides a conceptually simpler solution.",Gabriele Farina; Charilaos Pipis,~Gabriele_Farina1; ~Charilaos_Pipis1,NeurIPS 2024 spotlight,NeurIPS.cc/2024/Conference,algorithmic_game_theory,/pdf/6a58ad8a87873801cdd3838c48d1d9959c0a228b.pdf,2024-05-12T05:14:13.821000,2024-09-25T18:09:26.327000,2024-11-06T06:18:00.723000,https://openreview.net/forum?id=mZwilh3hd2,Massachusetts Institute of Technology
3008,ANO1i9JPtb,ANO1i9JPtb,4955,Buffer of Thoughts: Thought-Augmented Reasoning with Large Language Models,"We introduce Buffer of Thoughts (BoT), a novel and versatile thought-augmented reasoning approach for enhancing accuracy, efficiency and robustness of large language models (LLMs). Specifically, we propose meta-buffer to store a series of informative high-level thoughts, namely thought-template, distilled from the problem-solving processes across various tasks. Then for each problem, we retrieve a relevant thought-template and adaptively instantiate it with specific reasoning structures to conduct efficient reasoning. To guarantee the scalability and stability, we further propose buffer-manager to dynamically update the meta-buffer, thus enhancing the capacity of meta-buffer as more tasks are solved. We conduct extensive experiments on 10 challenging reasoning-intensive tasks, and achieve significant performance improvements over previous SOTA methods: 11\% on Game of 24, 20\% on Geometric Shapes and 51\% on Checkmate-in-One. Further analysis demonstrate the superior generalization ability and model robustness of our BoT, while requiring only 12\% of the cost of multi-query prompting methods (e.g., tree/graph of thoughts) on average. Code is available at: https://github.com/YangLing0818/buffer-of-thought-llm",Ling Yang; Zhaochen Yu; Tianjun Zhang; Shiyi Cao; Minkai Xu; Wentao Zhang; Joseph E. Gonzalez; Bin CUI,~Ling_Yang1; ~Zhaochen_Yu2; ~Tianjun_Zhang1; ~Shiyi_Cao1; ~Minkai_Xu1; ~Wentao_Zhang1; ~Joseph_E._Gonzalez1; ~Bin_CUI2,NeurIPS 2024 spotlight,NeurIPS.cc/2024/Conference,natural_language_processing,/pdf/1e9bd50c1379b65b4fe08ae09759cd95b6408b8c.pdf,2024-05-12T04:53:19.628000,2024-09-25T18:09:25.859000,2024-11-06T06:18:00.567000,https://openreview.net/forum?id=ANO1i9JPtb,"Peking University; Princeton University; Peking University; University of California, Berkeley; University of California, Berkeley; Stanford University; Peking University; University of California, Berkeley; Peking University"
3024,F8aSOovlEP,F8aSOovlEP,4887,MECD: Unlocking Multi-Event Causal Discovery in Video Reasoning,"Video causal reasoning aims to achieve a high-level understanding of video content from a causal perspective. However, current video reasoning tasks are limited in scope, primarily executed in a question-answering paradigm and focusing on short videos containing only a single event and simple causal relationships, lacking comprehensive and structured causality analysis for videos with multiple events. To fill this gap, we introduce a new task and dataset, Multi-Event Causal Discovery (MECD). It aims to uncover the causal relationships between events distributed chronologically across long videos. Given visual segments and textual descriptions of events, MECD requires identifying the causal associations between these events to derive a comprehensive, structured event-level video causal diagram explaining why and how the final result event occurred. To address MECD, we devise a novel framework inspired by the Granger Causality method, using an efficient mask-based event prediction model to perform an Event Granger Test, which estimates causality by comparing the predicted result event when premise events are masked versus unmasked. Furthermore, we integrate causal inference techniques such as front-door adjustment and counterfactual inference to address challenges in MECD like causality confounding and illusory causality. Experiments validate the effectiveness of our framework in providing causal relationships in multi-event videos, outperforming GPT-4o and VideoLLaVA by 5.7% and 4.1%, respectively.",Tieyuan Chen; Huabin Liu; Tianyao He; Yihang Chen; Chaofan Gan; Xiao Ma; Cheng Zhong; Yang Zhang; Yingxue Wang; Hui Lin; Weiyao Lin,~Tieyuan_Chen1; ~Huabin_Liu1; ~Tianyao_He1; ~Yihang_Chen2; ~Chaofan_Gan1; ~Xiao_Ma11; ~Cheng_Zhong5; ~Yang_Zhang23; ~Yingxue_Wang2; ~Hui_Lin7; ~Weiyao_Lin1,NeurIPS 2024 spotlight,NeurIPS.cc/2024/Conference,machine_vision,/pdf/d7e11b7d203a8b48880739fdf28f8bf16f08e095.pdf,2024-05-12T02:23:20.859000,2024-09-25T18:09:23.916000,2024-12-27T02:17:21.073000,https://openreview.net/forum?id=F8aSOovlEP,"Shanghai Jiao Tong University; Shanghai Jiao Tong University; Shanghai Jiao Tong University; Monash University; Shanghai Jiao Tong University; Shanghai Jiao Tong University; lenovo group; lenovo group; Lenovo Research, AI Lab; China electronics technology design and research institute; Shanghai Jiao Tong University"
3025,Kl13lipxTW,Kl13lipxTW,4885,BackTime: Backdoor Attacks on Multivariate Time Series Forecasting,"Multivariate Time Series (MTS) forecasting is a fundamental task with numerous real-world applications, such as transportation, climate, and epidemiology. While a myriad of powerful deep learning models have been developed for this task, few works have explored the robustness of MTS forecasting models to malicious attacks, which is crucial for their trustworthy employment in high-stake scenarios. To address this gap, we dive deep into the backdoor attacks on MTS forecasting models and propose an effective attack method named BackTime. By subtly injecting a few \textit{stealthy triggers} into the MTS data, BackTime can alter the predictions of the forecasting model according to the attacker's intent. Specifically, BackTime first identifies vulnerable timestamps in the data for poisoning, and then adaptively synthesizes stealthy and effective triggers by solving a bi-level optimization problem with a GNN-based trigger generator. Extensive experiments across multiple datasets and state-of-the-art MTS forecasting models demonstrate the effectiveness, versatility, and stealthiness of BackTime attacks.",Xiao Lin; Zhining Liu; Dongqi Fu; Ruizhong Qiu; Hanghang Tong,~Xiao_Lin8; ~Zhining_Liu1; ~Dongqi_Fu1; ~Ruizhong_Qiu1; ~Hanghang_Tong3,NeurIPS 2024 spotlight,NeurIPS.cc/2024/Conference,other,/pdf/1fa47bbd3756afb005487f49b0c6a1d97cef5555.pdf,2024-05-12T02:11:35.553000,2024-09-25T18:09:23.859000,2024-12-31T02:03:11.116000,https://openreview.net/forum?id=Kl13lipxTW,"Department of Computer Science, University of Illinois at Urbana Champaign; Department of Computer Science, University of Illinois at Urbana Champaign; Meta; Department of Computer Science, University of Illinois at Urbana Champaign; Department of Computer Science, University of Illinois at Urbana Champaign; Department of Computer Science, University of Illinois at Urbana Champaign"
