,id,forum,number,title,abstract,authors,authorids,venue,venueid,primary_area,pdf,cdate_iso,pdate_iso,mdate_iso,openreview_url,institutions
1961,6vNPPtWH1Q,6vNPPtWH1Q,10036,Energy-based Epistemic Uncertainty for Graph Neural Networks,"In domains with interdependent data, such as graphs, quantifying the epistemic uncertainty of a Graph Neural Network (GNN) is challenging as uncertainty can arise at different structural scales. Existing techniques neglect this issue or only distinguish between structure-aware and structure-agnostic uncertainty without combining them into a single measure. We propose GEBM, an energy-based model (EBM) that provides high-quality uncertainty estimates by aggregating energy at different structural levels that naturally arise from graph diffusion. In contrast to logit-based EBMs, we provably induce an integrable density in the data space by regularizing the energy function. We introduce an evidential interpretation of our EBM that significantly improves the predictive robustness of the GNN. Our framework is a simple and effective post hoc method applicable to any pre-trained GNN that is sensitive to various distribution shifts. It consistently achieves the best separation of in-distribution and out-of-distribution data on 6 out of 7 anomaly types while having the best average rank over shifts on *all* datasets.",Dominik Fuchsgruber; Tom Wollschläger; Stephan Günnemann,~Dominik_Fuchsgruber1; ~Tom_Wollschläger1; ~Stephan_Günnemann1,NeurIPS 2024 spotlight,NeurIPS.cc/2024/Conference,graph_neural_networks,/pdf/1d717d769b57f5f603b995bc1c814f0ba4f47c2f.pdf,2024-05-14T12:22:33.337000,2024-09-25T18:12:08.118000,2024-11-06T06:18:45.578000,https://openreview.net/forum?id=6vNPPtWH1Q,Technical University of Munich; Valence Labs powered by recursion; Technical University of Munich; Technical University of Munich
1963,5NMbQPY7Bn,5NMbQPY7Bn,10021,TOPA: Extending Large Language Models for Video Understanding via Text-Only Pre-Alignment,"Recent advancements in image understanding have benefited from the extensive use of web image-text pairs. However, video understanding remains a challenge despite the availability of substantial web video-text data. This difficulty primarily arises from the inherent complexity of videos and the inefficient language supervision in recent web-collected video-text datasets. In this paper, we introduce Text-Only Pre-Alignment (TOPA), a novel approach to extend large language models (LLMs) for video understanding, without the need for pre-training on real video data. Specifically, we first employ an advanced LLM to automatically generate Textual Videos comprising continuous textual frames, along with corresponding annotations to simulate real video-text data. Then, these annotated textual videos are used to pre-align a language-only LLM with the video modality. To bridge the gap between textual and real videos, we employ the CLIP model as the feature extractor to align image and text modalities. During text-only pre-alignment, the continuous textual frames, encoded as a sequence of CLIP text features, are analogous to continuous CLIP image features, thus aligning the LLM with real video representation. Extensive experiments, including zero-shot evaluation and finetuning on various video understanding tasks, demonstrate that TOPA is an effective and efficient framework for aligning video content with LLMs. In particular, without training on any video data, the TOPA-Llama2-13B model achieves a Top-1 accuracy of 51.0% on the challenging long-form video understanding benchmark, Egoschema. This performance surpasses previous video-text pre-training approaches and proves competitive with recent GPT-3.5 based video agents.",Wei Li; Hehe Fan; Yongkang Wong; Mohan Kankanhalli; Yi Yang,~Wei_Li55; ~Hehe_Fan1; ~Yongkang_Wong1; ~Mohan_Kankanhalli1; ~Yi_Yang4,NeurIPS 2024 spotlight,NeurIPS.cc/2024/Conference,machine_vision,/pdf/6981f892085bf5bded01c7caf3adde407ca7198f.pdf,2024-05-14T12:20:16.387000,2024-09-25T18:12:07.784000,2024-11-06T06:18:45.487000,https://openreview.net/forum?id=5NMbQPY7Bn,Zhejiang University; National University of Singapore; Zhejiang University; National University of Singapore; National University of Singapore; Zhejiang University
1968,p43ObIwJFW,p43ObIwJFW,9995,Learning to Solve Quadratic Unconstrained Binary Optimization in a Classification Way,"The quadratic unconstrained binary optimization (QUBO) is a well-known NP-hard problem that takes an $n\times n$ matrix $Q$ as input and decides an $n$-dimensional 0-1 vector $x$, to optimize a quadratic function. Existing learning-based models that always formulate the solution process as sequential decisions suffer from high computational overload. To overcome this issue, we propose a neural solver called the Value Classification Model (VCM) that formulates the solution process from a classification perspective. It applies a Depth Value Network (DVN) based on graph convolution that exploits the symmetry property in $Q$ to auto-grasp value features. These features are then fed into a Value Classification Network (VCN) which directly generates classification solutions. Trained by a highly efficient model-tailored Greedy-guided Self Trainer (GST) which does not require any priori optimal labels, VCM significantly outperforms competitors in both computational efficiency and solution quality with a remarkable generalization ability. It can achieve near-optimal solutions in milliseconds with an average optimality gap of just 0.362\% on benchmarks with up to 2500 variables. Notably, a VCM trained at a specific DVN depth can steadily find better solutions by simply extending the testing depth, which narrows the gap to 0.034\% on benchmarks. To our knowledge, this is the first learning-based model to reach such a performance.",Ming Chen; Jie Chun; Shang Xiang; Luona Wei; Yonghao Du; Qian Wan; Yuning Chen; Yingwu Chen,~Ming_Chen17; ~Jie_Chun1; ~Shang_Xiang1; ~Luona_Wei1; ~Yonghao_Du1; ~Qian_Wan2; ~Yuning_Chen2; ~Yingwu_Chen2,NeurIPS 2024 spotlight,NeurIPS.cc/2024/Conference,optimization,/pdf/5ac36f107f507f095117ea3f08a401ea0fc342a9.pdf,2024-05-14T12:14:51.343000,2024-09-25T18:12:07.007000,2024-11-06T06:18:45.292000,https://openreview.net/forum?id=p43ObIwJFW,National University of Defense Technology; South-Central Minzu University; Central China Normal University
1970,wTIzpqX121,wTIzpqX121,9990,Probabilistic Weather Forecasting with Hierarchical Graph Neural Networks,"In recent years, machine learning has established itself as a powerful tool for high-resolution weather forecasting. While most current machine learning models focus on deterministic forecasts, accurately capturing the uncertainty in the chaotic weather system calls for probabilistic modeling. We propose a probabilistic weather forecasting model called Graph-EFM, combining a flexible latent-variable formulation with the successful graph-based forecasting framework. The use of a hierarchical graph construction allows for efficient sampling of spatially coherent forecasts. Requiring only a single forward pass per time step, Graph-EFM allows for fast generation of arbitrarily large ensembles. We experiment with the model on both global and limited area forecasting. Ensemble forecasts from Graph-EFM achieve equivalent or lower errors than comparable deterministic models, with the added benefit of accurately capturing forecast uncertainty.",Joel Oskarsson; Tomas Landelius; Marc Peter Deisenroth; Fredrik Lindsten,~Joel_Oskarsson1; ~Tomas_Landelius1; ~Marc_Peter_Deisenroth1; ~Fredrik_Lindsten1,NeurIPS 2024 spotlight,NeurIPS.cc/2024/Conference,machine_learning_for_physical_sciences,/pdf/08914a753f1c9eaf87d2102390cab1b1f7a9663e.pdf,2024-05-14T12:13:32.141000,2024-09-25T18:12:06.835000,2024-11-06T06:18:45.232000,https://openreview.net/forum?id=wTIzpqX121,Linköping University; SMHI; Alan Turing Institute; University College London; Linköping University
1973,xabStWAUtr,xabStWAUtr,9984,Co-occurrence is not Factual Association in Language Models,"Pretrained language models can encode a large amount of knowledge and utilize it for various reasoning tasks, yet they can still struggle to learn novel factual knowledge effectively from finetuning on limited textual demonstrations. In this work, we show that the reason for this deficiency is that language models are biased to learn word co-occurrence statistics instead of true factual associations. We identify the differences between two forms of knowledge representation in language models: knowledge in the form of co-occurrence statistics is encoded in the middle layers of the transformer model and does not generalize well to reasoning scenarios beyond simple question answering, while true factual associations are encoded in the lower layers and can be freely utilized in various reasoning tasks. Based on these observations, we propose two strategies to improve the learning of factual associations in language models. We show that training on text with implicit rather than explicit factual associations can force the model to learn factual associations instead of co-occurrence statistics, significantly improving the generalization of newly learned knowledge. We also propose a simple training method to actively forget the learned co-occurrence statistics, which unblocks and enhances the learning of factual associations when training on plain narrative text. On both synthetic and real-world corpora, the two proposed strategies improve the generalization of the knowledge learned during finetuning to reasoning scenarios such as indirect and multi-hop question answering.",Xiao Zhang; Miao Li; Ji Wu,~Xiao_Zhang9; ~Miao_Li10; ~Ji_Wu3,NeurIPS 2024 spotlight,NeurIPS.cc/2024/Conference,natural_language_processing,/pdf/a05ca368d45ceff595e9950cf21de3cd1baf43fe.pdf,2024-05-14T12:12:41.814000,2024-09-25T18:12:06.504000,2025-01-16T10:20:25.689000,https://openreview.net/forum?id=xabStWAUtr,"Tsinghua University, Beijing; Tsinghua University, Beijing; Tsinghua University, Beijing"
1978,r5spnrY6H3,r5spnrY6H3,9950,RG-SAN: Rule-Guided Spatial Awareness Network for End-to-End 3D Referring Expression Segmentation,"3D Referring Expression Segmentation (3D-RES) aims to segment 3D objects by correlating referring expressions with point clouds. However, traditional approaches frequently encounter issues like over-segmentation or mis-segmentation, due to insufficient emphasis on spatial information of instances. In this paper, we introduce a Rule-Guided Spatial Awareness Network (RG-SAN) by utilizing solely the spatial information of the target instance for supervision. This approach enables the network to accurately depict the spatial relationships among all entities described in the text, thus enhancing the reasoning capabilities. The RG-SAN consists of the Text-driven Localization Module (TLM) and the Rule-guided Weak Supervision (RWS) strategy. The TLM initially locates all mentioned instances and iteratively refines their positional information. The RWS strategy, acknowledging that only target objects have supervised positional information, employs dependency tree rules to precisely guide the core instance’s positioning. Extensive testing on the ScanRefer benchmark has shown that RG-SAN not only establishes new performance benchmarks, with an mIoU increase of 5.1 points, but also exhibits significant improvements in robustness when processing descriptions with spatial ambiguity. All codes are available at https://github.com/sosppxo/RG-SAN.",Changli Wu; Qi Chen; Jiayi Ji; Haowei Wang; Yiwei Ma; You Huang; Gen Luo; Hao Fei; Xiaoshuai Sun; Rongrong Ji,~Changli_Wu1; ~Qi_Chen17; ~Jiayi_Ji1; ~Haowei_Wang1; ~Yiwei_Ma1; ~You_Huang1; ~Gen_Luo1; ~Hao_Fei1; ~Xiaoshuai_Sun3; ~Rongrong_Ji5,NeurIPS 2024 oral,NeurIPS.cc/2024/Conference,human-AI_interaction,/pdf/074c8caaa0b5feabaad18b25db6c0ee86ed09863.pdf,2024-05-14T12:06:19.815000,2024-09-25T18:12:05.616000,2024-12-22T10:46:48.168000,https://openreview.net/forum?id=r5spnrY6H3,Xiamen University; Xiamen University; Xiamen University; National University of Singapore; Xiamen University; Tencent; Xiamen University; Xiamen University; Xiamen University; Shanghai Artificial Intelligence Laboratory; National University of Singapore; Xiamen University; Xiamen University
1980,2bdSnxeQcW,2bdSnxeQcW,9935,Exclusively Penalized Q-learning for Offline Reinforcement Learning,"Constraint-based offline reinforcement learning (RL) involves policy constraints or imposing penalties on the value function to mitigate overestimation errors caused by distributional shift. This paper focuses on a limitation in existing offline RL methods with penalized value function, indicating the potential for underestimation bias due to unnecessary bias introduced in the value function. To address this concern, we propose Exclusively Penalized Q-learning (EPQ), which reduces estimation bias in the value function by selectively penalizing states that are prone to inducing estimation errors. Numerical results show that our method significantly reduces underestimation bias and improves performance in various offline control tasks compared to other offline RL methods.",Junghyuk Yeom; Yonghyeon Jo; Jeongmo Kim; Sanghyeon Lee; Seungyul Han,~Junghyuk_Yeom1; ~Yonghyeon_Jo1; ~Jeongmo_Kim1; ~Sanghyeon_Lee5; ~Seungyul_Han1,NeurIPS 2024 spotlight,NeurIPS.cc/2024/Conference,reinforcement_learning,/pdf/9c3bb8b1a229e4505ddfa9324ce3ec1e8eda68a6.pdf,2024-05-14T12:01:29.871000,2024-09-25T18:12:05.345000,2024-11-06T06:18:44.855000,https://openreview.net/forum?id=2bdSnxeQcW,Ulsan National Institute of Science and Technology; Ulsan National Institute of Science and Technology; Ulsan National Institute of Science and Technology; Ulsan National Institute of Science and Technology; Ulsan National Institute of Science and Technology
1992,shYQXpnBLB,shYQXpnBLB,9888,Association of Objects May Engender Stereotypes: Mitigating Association-Engendered Stereotypes in Text-to-Image Generation,"Text-to-Image (T2I) has witnessed significant advancements, demonstrating superior performance for various generative tasks. However, the presence of stereotypes in T2I introduces harmful biases that require urgent attention as the T2I 
 technology becomes more prominent.
Previous work for stereotype mitigation mainly concentrated on mitigating stereotypes engendered with individual objects within images, which failed to address stereotypes engendered by the association of multiple objects, referred to as *Association-Engendered Stereotypes*. For example, mentioning  ''black people'' and ''houses''  separately in prompts may not exhibit stereotypes. Nevertheless, when these two objects are associated in prompts, the association of ''black people'' with ''poorer houses'' becomes more pronounced. To tackle this issue, we propose a novel framework, MAS, to Mitigate Association-engendered Stereotypes. This framework models the stereotype problem as a probability distribution alignment problem, aiming to align the stereotype probability distribution of the generated image with the stereotype-free distribution. The MAS framework primarily consists of the *Prompt-Image-Stereotype CLIP* (*PIS CLIP*) and *Sensitive Transformer*. The *PIS CLIP* learns the association between prompts, images, and stereotypes, which can establish the mapping of prompts to stereotypes. The *Sensitive Transformer* produces the sensitive constraints, which guide the stereotyped image distribution to align with the stereotype-free probability distribution. Moreover, recognizing that existing metrics are insufficient for accurately evaluating association-engendered stereotypes, we propose a novel metric, *Stereotype-Distribution-Total-Variation*(*SDTV*), to evaluate stereotypes in T2I. Comprehensive experiments demonstrate that our framework effectively mitigates association-engendered stereotypes.",Junlei Zhou; Jiashi Gao; Xiangyu Zhao; Xin Yao; Xuetao Wei,~Junlei_Zhou4; ~Jiashi_Gao1; ~Xiangyu_Zhao1; ~Xin_Yao1; ~Xuetao_Wei2,NeurIPS 2024 spotlight,NeurIPS.cc/2024/Conference,diffusion_based_models,/pdf/204050fa8d15e07a423f0a1184f86bf90d8f7cf8.pdf,2024-05-14T11:50:22.898000,2024-09-25T18:12:03.819000,2025-01-13T01:30:22.167000,https://openreview.net/forum?id=shYQXpnBLB,Southern University of Science and Technology; Southern University of Science and Technology; City University of Hong Kong; Southern University of Science and Technology
2023,5zSCSE0k41,5zSCSE0k41,9714,VASA-1: Lifelike Audio-Driven Talking Faces Generated in Real Time,"We introduce VASA, a framework for generating lifelike talking faces with appealing visual affective skills (VAS) given a single static image and a speech audio clip. Our premiere model, VASA-1, is capable of not only generating lip movements that are exquisitely synchronized with the audio, but also producing a large spectrum of facial nuances and natural head motions that contribute to the perception of authenticity and liveliness. 
The core innovations include a diffusion-based holistic facial dynamics and head movement generation model that works in a face latent space, and the development of such an expressive and disentangled face latent space using videos.
Through extensive experiments including evaluation on a set of new metrics, we show that our method significantly outperforms previous methods along various dimensions comprehensively. Our method delivers high video quality with realistic facial and head dynamics and also supports the online generation of 512$\times$512 videos at up to 40 FPS with negligible starting latency.
It paves the way for real-time engagements with lifelike avatars that emulate human conversational behaviors.",Sicheng Xu; Guojun Chen; Yu-Xiao Guo; Jiaolong Yang; Chong Li; Zhenyu Zang; Yizhong Zhang; Xin Tong; Baining Guo,~Sicheng_Xu1; ~Guojun_Chen1; ~Yu-Xiao_Guo1; ~Jiaolong_Yang3; ~Chong_Li8; ~Zhenyu_Zang1; ~Yizhong_Zhang1; ~Xin_Tong1; ~Baining_Guo1,NeurIPS 2024 oral,NeurIPS.cc/2024/Conference,generative_models,/pdf/ccbb9d0f4688567aed95ad757cf65f0dd4538631.pdf,2024-05-14T11:01:02.426000,2024-09-25T18:11:58.879000,2024-11-06T06:18:42.902000,https://openreview.net/forum?id=5zSCSE0k41,Microsoft; Microsoft; Microsoft; Microsoft; Microsoft; Microsoft; Microsoft; Microsoft; Anuttacon; Microsoft
2036,1we1V3MAHD,1we1V3MAHD,9629,MotionBooth: Motion-Aware Customized Text-to-Video Generation,"In this work, we present MotionBooth, an innovative framework designed for animating customized subjects with precise control over both object and camera movements. By leveraging a few images of a specific object, we efficiently fine-tune a text-to-video model to capture the object's shape and attributes accurately. Our approach presents subject region loss and video preservation loss to enhance the subject's learning performance, along with a subject token cross-attention loss to integrate the customized subject with motion control signals. Additionally, we propose training-free techniques for managing subject and camera motions during inference. In particular, we utilize cross-attention map manipulation to govern subject motion and introduce a novel latent shift module for camera movement control as well. MotionBooth excels in preserving the appearance of subjects while simultaneously controlling the motions in generated videos. Extensive quantitative and qualitative evaluations demonstrate the superiority and effectiveness of our method. Models and codes will be made publicly available.",Jianzong Wu; Xiangtai Li; Yanhong Zeng; Jiangning Zhang; Qianyu Zhou; Yining Li; Yunhai Tong; Kai Chen,~Jianzong_Wu2; ~Xiangtai_Li1; ~Yanhong_Zeng1; ~Jiangning_Zhang1; ~Qianyu_Zhou1; ~Yining_Li1; ~Yunhai_Tong1; ~Kai_Chen4,NeurIPS 2024 spotlight,NeurIPS.cc/2024/Conference,diffusion_based_models,/pdf/a3f3aa90fe0891b06247e492408e30d8fb44fe1b.pdf,2024-05-14T10:37:51.727000,2024-09-25T18:11:56.736000,2024-11-06T06:18:42.383000,https://openreview.net/forum?id=1we1V3MAHD,Peking University; Nanyang Technological University; ByteDance Inc.; Shanghai Artificial Intelligence Laboratory; Tencent; Shanghai Jiao Tong University; Shanghai Artificial Intelligence Laboratory; Peking University; Shanghai Artificial Intelligence Laboratory
2059,bhSfbjS6j9,bhSfbjS6j9,9508,Multistable Shape from Shading Emerges from Patch Diffusion,"Models for inferring monocular shape of surfaces with diffuse reflection---shape from shading---ought to produce distributions of outputs, because there are fundamental mathematical ambiguities of both continuous (e.g., bas-relief) and discrete (e.g., convex/concave) types that are also experienced by humans. Yet, the outputs of current models are limited to point estimates or tight distributions around single modes, which prevent them from capturing these effects. We introduce a model that reconstructs a multimodal distribution of shapes from a single shading image, which aligns with the human experience of multistable perception. We train a small denoising diffusion process to generate surface normal fields from $16\times 16$ patches of synthetic images of everyday 3D objects. We deploy this model patch-wise at multiple scales, with guidance from inter-patch shape consistency constraints. Despite its relatively small parameter count and predominantly bottom-up structure, we show that multistable shape explanations emerge from this model for ambiguous test images that humans experience as being multistable. At the same time, the model produces veridical shape estimates for object-like images that include distinctive occluding contours and appear less ambiguous. This may inspire new architectures for stochastic 3D shape perception that are more efficient and better aligned with human experience.",Xinran Han; Todd Zickler; Ko Nishino,~Xinran_Han1; ~Todd_Zickler1; ~Ko_Nishino4,NeurIPS 2024 spotlight,NeurIPS.cc/2024/Conference,machine_vision,/pdf/c9b76d94959e0592a0305f254bcce8d77a7d3aff.pdf,2024-05-14T10:00:33.823000,2024-09-25T18:11:53.169000,2024-11-06T06:18:41.412000,https://openreview.net/forum?id=bhSfbjS6j9,Harvard University; Harvard University; Kyoto University
2073,QDYts5dYgq,QDYts5dYgq,9449,Learning rigid-body simulators over implicit shapes for large-scale scenes and vision,"Simulating large scenes with many rigid objects is crucial for a variety of applications, such as robotics, engineering, film and video games. Rigid interactions are notoriously hard to model: small changes to the initial state or the simulation parameters can lead to large changes in the final state. Recently, learned simulators based on graph networks (GNNs) were developed as an alternative to hand-designed simulators like MuJoCo and Bullet. They are able to accurately capture dynamics of real objects directly from real-world observations. However, current state-of-the-art learned simulators operate on meshes and scale poorly to scenes with many objects or detailed shapes. Here we present SDF-Sim, the first learned rigid-body simulator designed for scale. We use learned signed-distance functions (SDFs) to represent the object shapes and to speed up distance computation. We design the simulator to leverage SDFs and avoid the fundamental bottleneck of the previous simulators associated with collision detection.
For the first time in literature, we demonstrate that we can scale the GNN-based simulators to scenes with hundreds of objects and up to 1.1 million nodes, where mesh-based approaches run out of memory. Finally, we show that SDF-Sim can be applied to real world scenes by extracting SDFs from multi-view images.",Yulia Rubanova; Tatiana Lopez-Guevara; Kelsey R Allen; William F Whitney; Kim Stachenfeld; Tobias Pfaff,~Yulia_Rubanova2; ~Tatiana_Lopez-Guevara1; ~Kelsey_R_Allen1; ~William_F_Whitney1; ~Kim_Stachenfeld1; ~Tobias_Pfaff1,NeurIPS 2024 oral,NeurIPS.cc/2024/Conference,graph_neural_networks,/pdf/a025a4908402e558708ed28771812dd10af193dd.pdf,2024-05-14T09:46:20.370000,2024-09-25T18:11:51.520000,2024-11-06T06:18:40.845000,https://openreview.net/forum?id=QDYts5dYgq,Google; Google; Google; Columbia University; Google; Deepmind
2104,HRkniCWM3E,HRkniCWM3E,9295,Neural Pfaffians: Solving Many Many-Electron Schrödinger Equations,"Neural wave functions accomplished unprecedented accuracies in approximating the ground state of many-electron systems, though at a high computational cost. Recent works proposed amortizing the cost by learning generalized wave functions across different structures and compounds instead of solving each problem independently. Enforcing the permutation antisymmetry of electrons in such generalized neural wave functions remained challenging as existing methods require discrete orbital selection via non-learnable hand-crafted algorithms. This work tackles the problem by defining overparametrized, fully learnable neural wave functions suitable for generalization across molecules. We achieve this by relying on Pfaffians rather than Slater determinants. The Pfaffian allows us to enforce the antisymmetry on arbitrary electronic systems without any constraint on electronic spin configurations or molecular structure. Our empirical evaluation finds that a single neural Pfaffian calculates the ground state and ionization energies with chemical accuracy across various systems. On the TinyMol dataset, we outperform the `gold-standard' CCSD(T) CBS reference energies by 1.9m$E_h$ and reduce energy errors compared to previous generalized neural wave functions by up to an order of magnitude.",Nicholas Gao; Stephan Günnemann,~Nicholas_Gao1; ~Stephan_Günnemann1,NeurIPS 2024 oral,NeurIPS.cc/2024/Conference,machine_learning_for_physical_sciences,/pdf/c766b139548380a74ad7a69a3c638798a81d5de3.pdf,2024-05-14T09:12:51.546000,2024-09-25T18:11:46.499000,2024-11-06T06:18:39.638000,https://openreview.net/forum?id=HRkniCWM3E,Technical University of Munich; Technical University of Munich
