,id,forum,number,title,abstract,authors,authorids,venue,venueid,primary_area,pdf,cdate_iso,pdate_iso,mdate_iso,openreview_url,institutions
993,J2wI2rCG2u,J2wI2rCG2u,14856,Stochastic Taylor Derivative Estimator: Efficient amortization for arbitrary differential operators,"Optimizing neural networks with loss that contain high-dimensional and high-order differential operators
  is expensive to evaluate with back-propagation due to $\mathcal{O}(d^{k})$ scaling of the derivative tensor size and the $\mathcal{O}(2^{k-1}L)$ scaling in the computation graph, where $d$ is the dimension of the domain, $L$ is the number of ops in the forward computation graph, and $k$ is the derivative order. In previous works, the polynomial scaling in $d$ was addressed by amortizing the computation over the optimization process via randomization. Separately, the exponential scaling in $k$ for univariate functions ($d=1$) was addressed with high-order auto-differentiation (AD). In this work, we show how to efficiently perform arbitrary contraction of the derivative tensor of arbitrary order for multivariate functions, by properly constructing the input tangents to univariate high-order AD, which can be used to efficiently randomize any differential operator.
  When applied to Physics-Informed Neural Networks (PINNs), our method provides >1000$\times$ speed-up and >30$\times$ memory reduction over randomization with first-order AD, and we can now solve 1-million-dimensional PDEs in 8 minutes on a single NVIDIA A100 GPU. This work opens the possibility of using high-order differential operators in large-scale problems.",Zekun Shi; Zheyuan Hu; Min Lin; Kenji Kawaguchi,~Zekun_Shi3; ~Zheyuan_Hu1; ~Min_Lin1; ~Kenji_Kawaguchi1,NeurIPS 2024 oral,NeurIPS.cc/2024/Conference,machine_learning_for_physical_sciences,/pdf/8df82199f3b7e09ca3d98f528bb665d7c735933d.pdf,2024-05-15T06:29:46.923000,2024-09-25T18:14:41.130000,2025-01-17T13:36:05.617000,https://openreview.net/forum?id=J2wI2rCG2u,"National University of Singapore; Sea AI Lab, Sea, Singapore; National University of Singapore; Sea AI Lab, Sea, Singapore; National University of Singapore"
1000,4rCZeCZAON,4rCZeCZAON,14776,Do Finetti: On Causal Effects for Exchangeable Data,"We study causal effect estimation in a setting where the data are not i.i.d.$\ $(independent and identically distributed). We focus on exchangeable data satisfying an assumption of independent causal mechanisms. Traditional causal effect estimation frameworks, e.g., relying on structural causal models and do-calculus, are typically limited to i.i.d. data and do not extend to more general exchangeable generative processes, which naturally arise in multi-environment data. To address this gap, we develop a generalized framework for exchangeable data and introduce a truncated factorization formula that facilitates both the identification and estimation of causal effects in our setting. To illustrate potential applications, we introduce a causal Pólya urn model and demonstrate how intervention propagates effects in exchangeable data settings. Finally, we develop an algorithm that performs simultaneous causal discovery and effect estimation given multi-environment data.",Siyuan Guo; Chi Zhang; Karthika Mohan; Ferenc Huszár; Bernhard Schölkopf,~Siyuan_Guo1; ~Chi_Zhang23; ~Karthika_Mohan1; ~Ferenc_Huszár1; ~Bernhard_Schölkopf1,NeurIPS 2024 oral,NeurIPS.cc/2024/Conference,causal_inference,/pdf/8f348634669f055ea725df69d4de4fac31b49194.pdf,2024-05-15T06:13:20.360000,2024-09-25T18:14:38.991000,2024-11-06T06:19:28.394000,https://openreview.net/forum?id=4rCZeCZAON,"Max Planck Institute for Software Systems; University of Cambridge; Toyota Research Institute; ELLIS Institute, Tübingen; Max Planck Institute for Software Systems"
1010,fykjplMc0V,fykjplMc0V,14711,ReFT: Representation Finetuning for Language Models,"Parameter-efficient finetuning (PEFT) methods seek to adapt large neural models via updates to a small number of *weights*. However, much prior interpretability work has shown that *representations* encode rich semantic information, suggesting that editing representations might be a more powerful alternative. We pursue this hypothesis by developing a family of **Representation Finetuning (ReFT)** methods. ReFT methods operate on a frozen base model and learn task-specific interventions on hidden representations. We define a strong instance of the ReFT family, Low-rank Linear Subspace ReFT (LoReFT), and we identify an ablation of this method that trades some performance for increased efficiency. Both are drop-in replacements for existing PEFTs and learn interventions that are 15x--65x more parameter-efficient than LoRA. We showcase LoReFT on eight commonsense reasoning tasks, four arithmetic reasoning tasks, instruction-tuning, and GLUE. In all these evaluations, our ReFTs deliver the best balance of efficiency and performance, and almost always outperform state-of-the-art PEFTs. Upon publication, we will publicly release our generic ReFT training library.",Zhengxuan Wu; Aryaman Arora; Zheng Wang; Atticus Geiger; Dan Jurafsky; Christopher D Manning; Christopher Potts,~Zhengxuan_Wu1; ~Aryaman_Arora1; ~Zheng_Wang41; ~Atticus_Geiger1; ~Dan_Jurafsky1; ~Christopher_D_Manning1; ~Christopher_Potts1,NeurIPS 2024 spotlight,NeurIPS.cc/2024/Conference,natural_language_processing,/pdf/b8ce3ebf55fb6d6b3d11a228b12750efc960059f.pdf,2024-05-15T06:00:30.745000,2024-09-25T18:14:37.402000,2024-11-06T06:19:28.019000,https://openreview.net/forum?id=fykjplMc0V,Stanford University; Stanford University; Pr(Ai)²R Group; Stanford University; Stanford University
1011,4NJBV6Wp0h,4NJBV6Wp0h,14702,LLM Evaluators Recognize and Favor Their Own Generations,"Self-evaluation using large language models (LLMs) has proven valuable not only in benchmarking but also methods like reward modeling, constitutional AI, and self-refinement. But new biases are introduced due to the same LLM acting as both the evaluator and the evaluatee. One such bias is self-preference, where an LLM evaluator scores its own outputs higher than others’ while human annotators consider them of equal quality. But do LLMs actually recognize their own outputs when they give those texts higher scores, or is it just a coincidence? In this paper, we investigate if self-recognition capability contributes to self-preference. We discover that, out of the box, LLMs such as GPT-4 and Llama 2 have non-trivial accuracy at distinguishing themselves from other LLMs and humans. By finetuning LLMs, we discover a linear correlation between self-recognition capability and the strength of self-preference bias; using controlled experiments, we show that the causal explanation resists straightforward confounders. We discuss how self-recognition can interfere with unbiased evaluations and AI safety more generally.",Arjun Panickssery; Samuel R. Bowman; Shi Feng,~Arjun_Panickssery1; ~Samuel_R._Bowman1; ~Shi_Feng1,NeurIPS 2024 oral,NeurIPS.cc/2024/Conference,natural_language_processing,/pdf/17f3e3ce067de145352b0881a5a5a351cfcceac4.pdf,2024-05-15T05:59:19.696000,2024-09-25T18:14:37.167000,2024-11-06T06:19:27.996000,https://openreview.net/forum?id=4NJBV6Wp0h,New York University; Anthropic; New York University; George Washington University
1030,tUpcRQNvVM,tUpcRQNvVM,14619,Deep Submodular Peripteral Networks,"Submodular functions, crucial for various applications, often lack practical learning methods for their acquisition.  Seemingly unrelated, learning a scaling from oracles offering graded pairwise preferences (GPC) is underexplored, despite a rich history in psychometrics. In this paper, we introduce deep submodular peripteral networks (DSPNs), a novel parametric family of submodular functions, and methods for their training using a GPC-based strategy to connect and then tackle both of the above challenges.  We introduce newly devised GPC-style ``peripteral'' loss which leverages numerically graded relationships between pairs of objects (sets in our case). Unlike traditional contrastive learning, or RHLF preference ranking, our method utilizes graded comparisons, extracting more nuanced information than just binary-outcome comparisons, and contrasts sets of any size (not just two). We also define a novel suite of automatic sampling strategies for training, including active-learning inspired submodular feedback.  We demonstrate DSPNs' efficacy in learning submodularity from a costly target submodular function and demonstrate its superiority both for experimental design and online streaming applications.",Gantavya Bhatt; Arnav Mohanty Das; Jeff Bilmes,~Gantavya_Bhatt1; ~Arnav_Mohanty_Das1; ~Jeff_Bilmes1,NeurIPS 2024 spotlight,NeurIPS.cc/2024/Conference,active_learning,/pdf/172483363c72a00d7bbe1d70ca8e1b45baeb3889.pdf,2024-05-15T05:43:58.811000,2024-09-25T18:14:34.778000,2024-11-06T06:19:27.242000,https://openreview.net/forum?id=tUpcRQNvVM,University of Washington; University of Washington; University of Washington
1032,8on9dIUh5v,8on9dIUh5v,14607,Provable Benefit of Cutout and CutMix for Feature Learning,"Patch-level data augmentation techniques such as Cutout and CutMix have demonstrated significant efficacy in enhancing the performance of vision tasks. However, a comprehensive theoretical understanding of these methods remains elusive. In this paper, we study two-layer neural networks trained using three distinct methods: vanilla training without augmentation, Cutout training, and CutMix training. Our analysis focuses on a feature-noise data model, which consists of several label-dependent features of varying rarity and label-independent noises of differing strengths. Our theorems demonstrate that Cutout training can learn low-frequency features that vanilla training cannot, while CutMix training can learn even rarer features that Cutout cannot capture. From this, we establish that CutMix yields the highest test accuracy among the three. Our novel analysis reveals that CutMix training makes the network learn all features and noise vectors ""evenly"" regardless of the rarity and strength, which provides an interesting insight into understanding patch-level augmentation.",Junsoo Oh; Chulhee Yun,~Junsoo_Oh1; ~Chulhee_Yun1,NeurIPS 2024 spotlight,NeurIPS.cc/2024/Conference,learning_theory,/pdf/335004e49a3ba0f8a1f3e10f5b65da7bb40571f9.pdf,2024-05-15T05:41:55.950000,2024-09-25T18:14:34.331000,2024-11-06T06:19:27.123000,https://openreview.net/forum?id=8on9dIUh5v,Korea Advanced Institute of Science and Technology; Korea Advanced Institute of Science and Technology
1033,pR37AmwbOt,pR37AmwbOt,14597,Leveraging Catastrophic Forgetting to Develop Safe Diffusion Models against Malicious Finetuning,"Diffusion models (DMs) have demonstrated remarkable proficiency in producing images based on textual prompts. Numerous methods have been proposed to ensure these models generate safe images. Early methods attempt to incorporate safety filters into models to mitigate the risk of generating harmful images but such external filters do not inherently detoxify the model and can be easily bypassed. Hence, model unlearning and data cleaning are the most essential methods for maintaining the safety of models, given their impact on model parameters.
However, malicious fine-tuning can still make models prone to generating harmful or undesirable images even with these methods.
Inspired by the phenomenon of catastrophic forgetting, we propose a training policy using contrastive learning to increase the latent space distance between clean and harmful data distribution, thereby protecting models from being fine-tuned to generate harmful images due to forgetting.
The experimental results demonstrate that our methods not only maintain clean image generation capabilities before malicious fine-tuning but also effectively prevent DMs from producing harmful images after malicious fine-tuning. Our method can also be combined with other safety methods to maintain their safety against malicious fine-tuning further.",Jiadong Pan; Hongcheng Gao; Zongyu Wu; taihang Hu; Li Su; Qingming Huang; Liang Li,~Jiadong_Pan1; ~Hongcheng_Gao1; ~Zongyu_Wu1; ~taihang_Hu1; ~Li_Su4; ~Qingming_Huang2; ~Liang_Li3,NeurIPS 2024 spotlight,NeurIPS.cc/2024/Conference,diffusion_based_models,/pdf/93f012b5feddc8835a7a126bda5778236ec74ce2.pdf,2024-05-15T05:40:20.153000,2024-09-25T18:14:34.024000,2024-11-06T06:19:27.106000,https://openreview.net/forum?id=pR37AmwbOt,University of Chinese Academy of Sciences; University of Chinese Academy of Sciences; Pennsylvania State University; Nankai University; University of Chinese Academy of Sciences; University of Chinese Academy of Sciences; University of Chinese Academy of Sciences
1045,pGEY8JQ3qx,pGEY8JQ3qx,14527,Span-Based Optimal Sample Complexity for Weakly Communicating and General Average Reward MDPs,"We study the sample complexity of learning an $\varepsilon$-optimal policy in an average-reward Markov decision process (MDP) under a generative model. For weakly communicating MDPs, we establish the complexity bound $\widetilde{O}\left(SA\frac{\mathsf{H}}{\varepsilon^2} \right)$, where $\mathsf{H}$ is the span of the bias function of the optimal policy and $SA$ is the cardinality of the state-action space. Our result is the first that is minimax optimal (up to log factors) in all parameters $S,A,\mathsf{H}$, and $\varepsilon$, improving on existing work that either assumes uniformly bounded mixing times for all policies or has suboptimal dependence on the parameters. We also initiate the study of sample complexity in general (multichain) average-reward MDPs. We argue a new transient time parameter $\mathsf{B}$ is necessary, establish an $\widetilde{O}\left(SA\frac{\mathsf{B} + \mathsf{H}}{\varepsilon^2} \right)$ complexity bound, and prove a matching (up to log factors) minimax lower bound. Both results are based on reducing the average-reward MDP to a discounted MDP, which requires new ideas in the general setting. To optimally analyze this reduction, we develop improved bounds for $\gamma$-discounted MDPs, showing that $\widetilde{O}\left(SA\frac{\mathsf{H}}{(1-\gamma)^2\varepsilon^2} \right)$ and $\widetilde{O}\left(SA\frac{\mathsf{B} + \mathsf{H}}{(1-\gamma)^2\varepsilon^2} \right)$ samples suffice to learn $\varepsilon$-optimal policies in weakly communicating and in general MDPs, respectively. Both these results circumvent the well-known minimax lower bound of $\widetilde{\Omega}\left(SA\frac{1}{(1-\gamma)^3\varepsilon^2} \right)$ for $\gamma$-discounted MDPs, and establish a quadratic rather than cubic horizon dependence for a fixed MDP instance.",Matthew Zurek; Yudong Chen,~Matthew_Zurek1; ~Yudong_Chen1,NeurIPS 2024 oral,NeurIPS.cc/2024/Conference,reinforcement_learning,/pdf/2ff245e09d2ec82378e2aa6ffea57a9ec01c043c.pdf,2024-05-15T05:28:23.496000,2024-09-25T18:14:31.896000,2024-11-06T06:19:26.574000,https://openreview.net/forum?id=pGEY8JQ3qx,University of Wisconsin - Madison; University of Wisconsin - Madison
1066,uNKlTQ8mBD,uNKlTQ8mBD,14424,Learning Formal Mathematics From Intrinsic Motivation,"How did humanity coax mathematics from the aether? We explore the Platonic view that mathematics can be discovered from its axioms---a game of conjecture and proof. We describe an agent that jointly learns to pose challenging problems for itself (conjecturing) and solve them (theorem proving). Given a mathematical domain axiomatized in dependent type theory, we first combine methods for constrained decoding and type-directed synthesis to sample valid conjectures from a language model. Our method guarantees well-formed conjectures by construction, even as we start with a randomly initialized model. We use the same model to represent a policy and value function for guiding proof search. Our agent targets generating hard but provable conjectures --- a moving target, since its own theorem proving ability also improves as it trains. We propose novel methods for hindsight relabeling on proof search trees to significantly improve the agent's sample efficiency in both tasks. Experiments on 3 axiomatic domains (propositional logic, arithmetic and group theory) demonstrate that our agent can bootstrap from only the axioms, self-improving in generating true and challenging conjectures and in finding proofs.",Gabriel Poesia; David Broman; Nick Haber; Noah Goodman,~Gabriel_Poesia1; ~David_Broman1; ~Nick_Haber1; ~Noah_Goodman1,NeurIPS 2024 oral,NeurIPS.cc/2024/Conference,machine_learning_for_other_sciences_and_fields,/pdf/42d3b14720041d447c657071a08de640733954a0.pdf,2024-05-15T05:10:48.858000,2024-09-25T18:14:29.029000,2024-11-06T06:19:25.709000,https://openreview.net/forum?id=uNKlTQ8mBD,Stanford University; KTH Royal Institute of Technology; Stanford University; Stanford University
1075,JyWAFGCJPl,JyWAFGCJPl,14368,Fine Tuning Out-of-Vocabulary Item Recommendation with User Sequence Imagination,"Recommending out-of-vocabulary (OOV) items is a challenging problem since the in-vocabulary (IV) items have well-trained behavioral embeddings but the OOV items only have content features. Current OOV recommendation models often generate 'makeshift' embeddings for OOV items from content features and then jointly recommend with the `makeshift' OOV item embeddings and the behavioral IV item embeddings. However, merely using the 'makeshift' embedding will result in suboptimal recommendation performance due to the substantial gap between the content feature and the behavioral embeddings. To bridge the gap, we propose a novel **User Sequence IMagination (USIM)** fine-tuning framework, which first imagines the user sequences and then refines the generated OOV embeddings with the user behavioral embeddings. Specifically, we frame the user sequence imagination as a reinforcement learning problem and develop a recommendation-focused reward function to evaluate to what extent a user can help recommend the OOV items. Besides, we propose an embedding-driven transition function to model the embedding transition after imaging a user. USIM has been deployed on a prominent e-commerce platform for months, offering recommendations for millions of OOV items and billions of users. Extensive experiments demonstrate that USIM outperforms traditional generative models in OOV item recommendation performance across traditional collaborative filtering and GNN-based collaborative filtering models.",Ruochen Liu; Hao Chen; Yuanchen Bei; Qijie Shen; Fangwei Zhong; Senzhang Wang; Jianxin Wang,~Ruochen_Liu5; ~Hao_Chen18; ~Yuanchen_Bei1; ~Qijie_Shen1; ~Fangwei_Zhong3; ~Senzhang_Wang2; ~Jianxin_Wang1,NeurIPS 2024 spotlight,NeurIPS.cc/2024/Conference,other,/pdf/bce6d564cb85e7281193357b8911576c79355256.pdf,2024-05-15T04:59:09.102000,2024-09-25T18:14:27.447000,2024-12-24T11:35:01.899000,https://openreview.net/forum?id=JyWAFGCJPl,Central South University; City University of Macao; Hong Kong Polytechnic University; Zhejiang University; Alibaba Group; Beijing Normal University; Peking University; Central South University; Central South University
1076,dlCTmEyq6y,dlCTmEyq6y,14367,Semi-Supervised Sparse Gaussian Classification: Provable Benefits of Unlabeled Data,"The premise of semi-supervised learning (SSL) is that combining labeled and unlabeled data yields significantly more accurate models.
Despite empirical successes, the theoretical understanding of SSL is still far from complete. 
In this work, we study SSL for high dimensional sparse Gaussian classification. 
To construct an accurate classifier a  key task is feature selection, detecting the few variables that separate the two classes.
For this SSL setting, we analyze information theoretic lower bounds for accurate feature selection as well as computational lower bounds, 
assuming the low-degree likelihood hardness conjecture. 
Our key contribution is the identification of a regime in the problem parameters (dimension, sparsity, number of labeled and unlabeled samples) where SSL is guaranteed to be advantageous for classification.
Specifically, there is a regime where it is possible to construct in polynomial time an accurate SSL classifier.
However, any computationally efficient supervised or unsupervised learning schemes, that separately use only the labeled or unlabeled data would fail.  
Our work highlights the provable benefits of combining labeled and unlabeled data for classification and feature selection in high dimensions. 
We present simulations that complement our theoretical analysis.",Eyar Azar; Boaz Nadler,~Eyar_Azar1; ~Boaz_Nadler2,NeurIPS 2024 spotlight,NeurIPS.cc/2024/Conference,learning_theory,/pdf/266ad38dd7db36a6cc250200fbe2a1107a08fc97.pdf,2024-05-15T04:58:56.732000,2024-09-25T18:14:27.387000,2024-11-06T06:19:25.245000,https://openreview.net/forum?id=dlCTmEyq6y,Weizmann Institute of Science; Weizmann Institute of Science
1103,b1ggjW00NI,b1ggjW00NI,14182,Don't Look Twice: Faster Video Transformers with Run-Length Tokenization,"Video transformers are slow to train due to extremely large numbers of input tokens, even though many video tokens are repeated over time. Existing methods to remove uninformative tokens either have significant overhead, negating any speedup, or require tuning for different datasets and examples. We present Run-Length Tokenization (RLT), a simple approach to speed up video transformers inspired by run-length encoding for data compression. RLT efficiently finds and removes `runs' of patches that are repeated over time before model inference, then replaces them with a single patch and a positional encoding to represent the resulting token's new length. 
Our method is content-aware, requiring no tuning for different datasets, and fast, incurring negligible overhead. 
RLT yields a large speedup in training, reducing the wall-clock time to fine-tune a video transformer by 30% while matching baseline model performance. RLT also works without training, increasing model throughput by 35% with only 0.1% drop in accuracy.
RLT speeds up training at 30 FPS by more than 100%, and on longer video datasets, can reduce the token count by up to 80\%. Our project page is at  rccchoudhury.github.io/projects/rlt.",Rohan Choudhury; Guanglei Zhu; Sihan Liu; Koichiro Niinuma; Kris M. Kitani; Laszlo Attila Jeni,~Rohan_Choudhury1; ~Guanglei_Zhu1; ~Sihan_Liu3; ~Koichiro_Niinuma1; ~Kris_M._Kitani1; ~Laszlo_Attila_Jeni1,NeurIPS 2024 spotlight,NeurIPS.cc/2024/Conference,machine_vision,/pdf/dd99432c8f2dff551850e041e3841a2d75932e8c.pdf,2024-05-15T04:24:58.426000,2024-09-25T18:14:22.567000,2024-11-06T06:19:24.102000,https://openreview.net/forum?id=b1ggjW00NI,Meta; Carnegie Mellon University; Carnegie Mellon University; Carnegie Mellon University; Fujitsu Research and Development Center; Meta; Carnegie Mellon University; Carnegie Mellon University
1105,ektPEcqGLb,ektPEcqGLb,14174,Poisson Variational Autoencoder,"Variational autoencoders (VAE) employ Bayesian inference to interpret sensory inputs, mirroring processes that occur in primate vision across both ventral (Higgins et al., 2021) and dorsal (Vafaii et al., 2023) pathways. Despite their success, traditional VAEs rely on continuous latent variables, which significantly deviates from the discrete nature of biological neurons. Here, we developed the Poisson VAE (P-VAE), a novel architecture that combines principles of predictive coding with a VAE that encodes inputs into discrete spike counts. Combining Poisson-distributed latent variables with predictive coding introduces a metabolic cost term in the model loss function, suggesting a relationship with sparse coding which we verify empirically. Additionally, we analyze the geometry of learned representations, contrasting the P-VAE to alternative VAE models. We find that the P-VAE encodes its inputs in relatively higher dimensions, facilitating linear separability of categories in a downstream classification task with a much better (5x) sample efficiency. Our work provides an interpretable computational framework to study brain-like sensory processing and paves the way for a deeper understanding of perception as an inferential process.",Hadi Vafaii; Dekel Galor; Jacob L. Yates,~Hadi_Vafaii1; ~Dekel_Galor1; ~Jacob_L._Yates1,NeurIPS 2024 spotlight,NeurIPS.cc/2024/Conference,generative_models,/pdf/69d52ba3321603d15a0f74c21d108f4a11c54a36.pdf,2024-05-15T04:23:40.535000,2024-09-25T18:14:22.342000,2024-12-18T19:19:21.107000,https://openreview.net/forum?id=ektPEcqGLb,"University of California, Berkeley; University of California, Berkeley"
